{
  "decision_id": "d-northwind-2026-001",
  "decision_timestamp": "2026-05-22T14:45:12Z",
  "input_submission_id": "s-northwind-2026-05-22-001",
  "input_schema_version": "1.0.0",
  "agent_version": "vrt-agent-v0.1.0-abc123def",
  "risk_tier": "tier_2_moderate",
  "recommended_disposition": "conditional_approve",
  "classification_rationale": "Vendor uses AI in operational decisions (ticket routing) that affect internal workflows but not customer outcomes directly. Disclosed PII handling indicates contact data flows through the classifier with no retention beyond the routing decision. Vendor self-classifies as limited risk under the EU AI Act, consistent with the operational-decision scope.",
  "evidence_cited": [
    {
      "input_field_reference": "$.ai_usage_level",
      "reasoning": "Reported as 'operational_decisions', which under the internal risk taxonomy in docs/phase-0/01-risk-classification.md places the vendor at the Tier 2 floor."
    },
    {
      "input_field_reference": "$.ai_features_disclosed[0].autonomy",
      "reasoning": "The disclosed routing feature operates as 'human_confirmed', meaning human review attaches to each routing decision. This preserves the human-in-the-loop precondition assumed by the disposition flow."
    },
    {
      "input_field_reference": "$.pii_processing_claims.handling_notes",
      "reasoning": "Vendor states PII is processed but not retained beyond the routing decision. The claim is recorded as the vendor's representation; verification is a vendor-management function task per docs/phase-1/01-out-of-scope.md."
    }
  ],
  "confidence_signal": {
    "score": 0.82,
    "interpretation": "high"
  },
  "output_schema_version": "1.0.0",
  "required_mitigations": [
    "Verify vendor's PII non-retention claim through security validation function before contract renewal.",
    "Quarterly review of disclosed AI features for scope creep, particularly any movement toward customer_facing or regulated_decisions levels."
  ],
  "review_interval_days": 90,
  "regulatory_framework_tags": ["EU_AI_Act_Annex_III", "OSFI_E_23"]
}
